[
  {
    "id": "Q00029",
    "content": "你愿意为了不让朋友失望，放弃自己原定的独立计划去陪他吗？",
    "type": "YN",
    "category": "social",
    "difficulty": "medium",
    "tags": [
      "self_protection",
      "freedom"
    ],
    "weights": [
      {
        "dimension": "self_protection",
        "yes": -3,
        "no": 3
      },
      {
        "dimension": "freedom",
        "yes": -1,
        "no": 1
      }
    ],
    "metadata": {
      "version": 1,
      "status": "active"
    }
  },
  {
    "id": "Q00030",
    "content": "你愿意为了帮同事保住项目，承担一部分原本不属于你的工作吗？",
    "type": "YN",
    "category": "risk",
    "difficulty": "medium",
    "tags": [
      "self_protection",
      "collectivism"
    ],
    "weights": [
      {
        "dimension": "self_protection",
        "yes": -3,
        "no": 3
      },
      {
        "dimension": "collectivism",
        "yes": 3,
        "no": -3
      }
    ],
    "metadata": {
      "version": 1,
      "status": "active"
    }
  },
  {
    "id": "Q00031",
    "content": "你愿意为了家人生活得更好，接受一份更辛苦但收入更高的工作吗？",
    "type": "YN",
    "category": "wealth",
    "difficulty": "easy",
    "tags": [
      "self_protection",
      "altruism"
    ],
    "weights": [
      {
        "dimension": "self_protection",
        "yes": -3,
        "no": 3
      },
      {
        "dimension": "altruism",
        "yes": 3,
        "no": -3
      }
    ],
    "metadata": {
      "version": 1,
      "status": "active"
    }
  },
  {
    "id": "Q00032",
    "content": "你愿意为了集体在谈判中争取到更好条件，主动让步自己的一份利益吗？",
    "type": "YN",
    "category": "social",
    "difficulty": "hard",
    "tags": [
      "self_protection",
      "collectivism"
    ],
    "weights": [
      {
        "dimension": "self_protection",
        "yes": -3,
        "no": 3
      },
      {
        "dimension": "collectivism",
        "yes": 3,
        "no": -3
      }
    ],
    "metadata": {
      "version": 1,
      "status": "active"
    }
  }
]