[
  {
    "id": "Q00101",
    "content": "你愿意为了上班更方便，接受公司对打卡时间的严格要求吗？",
    "type": "YN",
    "category": "control",
    "difficulty": "easy",
    "tags": [
      "freedom",
      "security"
    ],
    "weights": [
      {
        "dimension": "freedom",
        "yes": -1,
        "no": 1
      },
      {
        "dimension": "security",
        "yes": 1,
        "no": -1
      }
    ],
    "metadata": {
      "version": 1,
      "status": "active"
    }
  },
  {
    "id": "Q00102",
    "content": "你愿意为了获得补贴，接受统一安排的工作岗位吗？",
    "type": "YN",
    "category": "wealth",
    "difficulty": "easy",
    "tags": [
      "freedom",
      "wealth"
    ],
    "weights": [
      {
        "dimension": "freedom",
        "yes": -1,
        "no": 1
      },
      {
        "dimension": "wealth",
        "yes": 2,
        "no": -2
      }
    ],
    "metadata": {
      "version": 1,
      "status": "active"
    }
  },
  {
    "id": "Q00103",
    "content": "你愿意为了少操心，让别人帮你决定每天的行程吗？",
    "type": "YN",
    "category": "control",
    "difficulty": "easy",
    "tags": [
      "freedom",
      "security"
    ],
    "weights": [
      {
        "dimension": "freedom",
        "yes": -1,
        "no": 1
      },
      {
        "dimension": "security",
        "yes": 1,
        "no": -1
      }
    ],
    "metadata": {
      "version": 1,
      "status": "active"
    }
  },
  {
    "id": "Q00104",
    "content": "你愿意为了融入集体，放弃自己独特的穿衣风格吗？",
    "type": "YN",
    "category": "social",
    "difficulty": "easy",
    "tags": [
      "freedom",
      "collectivism"
    ],
    "weights": [
      {
        "dimension": "freedom",
        "yes": -1,
        "no": 1
      },
      {
        "dimension": "collectivism",
        "yes": 1,
        "no": -1
      }
    ],
    "metadata": {
      "version": 1,
      "status": "active"
    }
  }
]