[
  {
    "id": "Q00153",
    "content": "你愿意为了可能实现财富自由，赌上自己全部的积蓄吗？",
    "type": "YN",
    "category": "risk",
    "difficulty": "hard",
    "tags": [
      "security",
      "wealth"
    ],
    "weights": [
      {
        "dimension": "security",
        "yes": -4,
        "no": 4
      },
      {
        "dimension": "wealth",
        "yes": 5,
        "no": -5
      }
    ],
    "metadata": {
      "version": 1,
      "status": "active"
    }
  },
  {
    "id": "Q00154",
    "content": "你愿意为了自由的生活，放弃所有的稳定保障，过上漂泊不定的日子吗？",
    "type": "YN",
    "category": "future",
    "difficulty": "hard",
    "tags": [
      "security",
      "freedom"
    ],
    "weights": [
      {
        "dimension": "security",
        "yes": -4,
        "no": 4
      },
      {
        "dimension": "freedom",
        "yes": 4,
        "no": -4
      }
    ],
    "metadata": {
      "version": 1,
      "status": "active"
    }
  },
  {
    "id": "Q00155",
    "content": "你愿意为了体验极致的冒险，承担可能危及生命的风险吗？",
    "type": "YN",
    "category": "risk",
    "difficulty": "hard",
    "tags": [
      "security",
      "freedom"
    ],
    "weights": [
      {
        "dimension": "security",
        "yes": -4,
        "no": 4
      },
      {
        "dimension": "freedom",
        "yes": 4,
        "no": -4
      }
    ],
    "metadata": {
      "version": 1,
      "status": "active"
    }
  },
  {
    "id": "Q00156",
    "content": "你愿意为了追求个人的突破，拒绝一切让你安稳的常规安排吗？",
    "type": "YN",
    "category": "control",
    "difficulty": "hard",
    "tags": [
      "security",
      "freedom"
    ],
    "weights": [
      {
        "dimension": "security",
        "yes": -4,
        "no": 4
      },
      {
        "dimension": "freedom",
        "yes": 3,
        "no": -3
      }
    ],
    "metadata": {
      "version": 1,
      "status": "active"
    }
  }
]