[
  {
    "id": "Q00229",
    "content": "你愿意为了陪伴家人，放弃一份高薪但常年出差的工作吗？",
    "type": "YN",
    "category": "social",
    "difficulty": "medium",
    "tags": [
      "wealth",
      "collectivism"
    ],
    "weights": [
      {
        "dimension": "wealth",
        "yes": -3,
        "no": 3
      },
      {
        "dimension": "collectivism",
        "yes": 2,
        "no": -2
      }
    ],
    "metadata": {
      "version": 1,
      "status": "active"
    }
  },
  {
    "id": "Q00230",
    "content": "你愿意为了内心的安宁，放弃高收入的职业转做公益事业吗？",
    "type": "YN",
    "category": "morality",
    "difficulty": "medium",
    "tags": [
      "wealth",
      "altruism"
    ],
    "weights": [
      {
        "dimension": "wealth",
        "yes": -3,
        "no": 3
      },
      {
        "dimension": "altruism",
        "yes": 3,
        "no": -3
      }
    ],
    "metadata": {
      "version": 1,
      "status": "active"
    }
  },
  {
    "id": "Q00231",
    "content": "你愿意为了追求自己向往的生活方式，接受清贫但自由的日子吗？",
    "type": "YN",
    "category": "future",
    "difficulty": "hard",
    "tags": [
      "wealth",
      "freedom"
    ],
    "weights": [
      {
        "dimension": "wealth",
        "yes": -3,
        "no": 3
      },
      {
        "dimension": "freedom",
        "yes": 3,
        "no": -3
      }
    ],
    "metadata": {
      "version": 1,
      "status": "active"
    }
  },
  {
    "id": "Q00232",
    "content": "你愿意为了帮助有需要的人，常年捐出自己收入的十分之三吗？",
    "type": "YN",
    "category": "morality",
    "difficulty": "medium",
    "tags": [
      "wealth",
      "altruism"
    ],
    "weights": [
      {
        "dimension": "wealth",
        "yes": -3,
        "no": 3
      },
      {
        "dimension": "altruism",
        "yes": 3,
        "no": -3
      }
    ],
    "metadata": {
      "version": 1,
      "status": "active"
    }
  }
]