[
  {
    "id": "Q00297",
    "content": "你愿意为了效率，选择最直接简单的办法吗？",
    "type": "YN",
    "category": "control",
    "difficulty": "easy",
    "tags": [
      "pragmatism",
      "rule_orientation"
    ],
    "weights": [
      {
        "dimension": "pragmatism",
        "yes": 1,
        "no": -1
      },
      {
        "dimension": "rule_orientation",
        "yes": -1,
        "no": 1
      }
    ],
    "metadata": {
      "version": 1,
      "status": "active"
    }
  },
  {
    "id": "Q00298",
    "content": "你愿意为了省事，接受一个够用但并非最优的解决方案吗？",
    "type": "YN",
    "category": "control",
    "difficulty": "easy",
    "tags": [
      "pragmatism",
      "freedom"
    ],
    "weights": [
      {
        "dimension": "pragmatism",
        "yes": 1,
        "no": -1
      },
      {
        "dimension": "freedom",
        "yes": -1,
        "no": 1
      }
    ],
    "metadata": {
      "version": 1,
      "status": "active"
    }
  },
  {
    "id": "Q00299",
    "content": "你愿意为了实际方便，放弃一些繁琐但规范的做法吗？",
    "type": "YN",
    "category": "control",
    "difficulty": "easy",
    "tags": [
      "pragmatism",
      "rule_orientation"
    ],
    "weights": [
      {
        "dimension": "pragmatism",
        "yes": 1,
        "no": -1
      },
      {
        "dimension": "rule_orientation",
        "yes": -1,
        "no": 1
      }
    ],
    "metadata": {
      "version": 1,
      "status": "active"
    }
  },
  {
    "id": "Q00300",
    "content": "你愿意为了当下的便利，不去纠结事情的长远影响吗？",
    "type": "YN",
    "category": "future",
    "difficulty": "easy",
    "tags": [
      "pragmatism",
      "long_term"
    ],
    "weights": [
      {
        "dimension": "pragmatism",
        "yes": 1,
        "no": -1
      },
      {
        "dimension": "long_term",
        "yes": -1,
        "no": 1
      }
    ],
    "metadata": {
      "version": 1,
      "status": "active"
    }
  }
]