[
  {
    "id": "Q00105",
    "content": "你愿意为了获得稳定的收入，接受一份严格管控你时间的工作吗？",
    "type": "YN",
    "category": "control",
    "difficulty": "easy",
    "tags": [
      "freedom",
      "security"
    ],
    "weights": [
      {
        "dimension": "freedom",
        "yes": -2,
        "no": 2
      },
      {
        "dimension": "security",
        "yes": 2,
        "no": -2
      }
    ],
    "metadata": {
      "version": 1,
      "status": "active"
    }
  },
  {
    "id": "Q00106",
    "content": "你愿意为了减少选择带来的压力，让别人替你决定重要的人生方向吗？",
    "type": "YN",
    "category": "personal_boundary",
    "difficulty": "medium",
    "tags": [
      "freedom",
      "security"
    ],
    "weights": [
      {
        "dimension": "freedom",
        "yes": -2,
        "no": 2
      },
      {
        "dimension": "security",
        "yes": 1,
        "no": -1
      }
    ],
    "metadata": {
      "version": 1,
      "status": "active"
    }
  },
  {
    "id": "Q00107",
    "content": "你愿意为了获得更多的福利，接受公司对员工生活的统一管理吗？",
    "type": "YN",
    "category": "control",
    "difficulty": "medium",
    "tags": [
      "freedom",
      "wealth"
    ],
    "weights": [
      {
        "dimension": "freedom",
        "yes": -2,
        "no": 2
      },
      {
        "dimension": "wealth",
        "yes": 2,
        "no": -2
      }
    ],
    "metadata": {
      "version": 1,
      "status": "active"
    }
  },
  {
    "id": "Q00108",
    "content": "你愿意为了家庭和睦，放弃自己远行的自由定居在家人身边吗？",
    "type": "YN",
    "category": "social",
    "difficulty": "medium",
    "tags": [
      "freedom",
      "collectivism"
    ],
    "weights": [
      {
        "dimension": "freedom",
        "yes": -2,
        "no": 2
      },
      {
        "dimension": "collectivism",
        "yes": 2,
        "no": -2
      }
    ],
    "metadata": {
      "version": 1,
      "status": "active"
    }
  }
]