[
  {
    "id": "Q00317",
    "content": "你愿意为了一个看似不可能实现的远大理想，赌上自己的一生吗？",
    "type": "YN",
    "category": "future",
    "difficulty": "hard",
    "tags": [
      "pragmatism",
      "long_term"
    ],
    "weights": [
      {
        "dimension": "pragmatism",
        "yes": -5,
        "no": 5
      },
      {
        "dimension": "long_term",
        "yes": 5,
        "no": -5
      }
    ],
    "metadata": {
      "version": 1,
      "status": "active"
    }
  },
  {
    "id": "Q00318",
    "content": "你愿意为了坚持绝对的正义，即使毁灭自己的现实生活也不退缩吗？",
    "type": "YN",
    "category": "morality",
    "difficulty": "hard",
    "tags": [
      "pragmatism",
      "rule_orientation"
    ],
    "weights": [
      {
        "dimension": "pragmatism",
        "yes": -5,
        "no": 5
      },
      {
        "dimension": "rule_orientation",
        "yes": 5,
        "no": -5
      }
    ],
    "metadata": {
      "version": 1,
      "status": "active"
    }
  },
  {
    "id": "Q00319",
    "content": "你愿意为了崇高的信念，完全无视现实条件的种种限制吗？",
    "type": "YN",
    "category": "future",
    "difficulty": "hard",
    "tags": [
      "pragmatism",
      "long_term"
    ],
    "weights": [
      {
        "dimension": "pragmatism",
        "yes": -5,
        "no": 5
      },
      {
        "dimension": "long_term",
        "yes": 4,
        "no": -4
      }
    ],
    "metadata": {
      "version": 1,
      "status": "active"
    }
  },
  {
    "id": "Q00320",
    "content": "你愿意为了纯粹理想主义的追求，彻底放弃一切物质保障吗？",
    "type": "YN",
    "category": "future",
    "difficulty": "hard",
    "tags": [
      "pragmatism",
      "wealth"
    ],
    "weights": [
      {
        "dimension": "pragmatism",
        "yes": -5,
        "no": 5
      },
      {
        "dimension": "wealth",
        "yes": -4,
        "no": 4
      }
    ],
    "metadata": {
      "version": 1,
      "status": "active"
    }
  }
]