[
  {
    "id": "Q00477",
    "content": "你愿意为了体验极致的人生，让自己长期处于生命危险之中吗？",
    "type": "YN",
    "category": "must",
    "difficulty": "hard",
    "tags": [
      "security",
      "freedom"
    ],
    "weights": [
      {
        "dimension": "security",
        "yes": -5,
        "no": 5
      },
      {
        "dimension": "freedom",
        "yes": 5,
        "no": -5
      }
    ],
    "metadata": {
      "version": 1,
      "status": "active"
    }
  },
  {
    "id": "Q00478",
    "content": "你愿意为了守住自己的一切，看着他人陷入绝境而不施以援手吗？",
    "type": "YN",
    "category": "must",
    "difficulty": "hard",
    "tags": [
      "altruism",
      "self_protection"
    ],
    "weights": [
      {
        "dimension": "altruism",
        "yes": -5,
        "no": 5
      },
      {
        "dimension": "self_protection",
        "yes": 5,
        "no": -5
      }
    ],
    "metadata": {
      "version": 1,
      "status": "active"
    }
  },
  {
    "id": "Q00479",
    "content": "你愿意为了保全自己，牺牲整个群体的利益吗？",
    "type": "YN",
    "category": "must",
    "difficulty": "hard",
    "tags": [
      "collectivism",
      "self_protection"
    ],
    "weights": [
      {
        "dimension": "collectivism",
        "yes": -5,
        "no": 5
      },
      {
        "dimension": "self_protection",
        "yes": 5,
        "no": -5
      }
    ],
    "metadata": {
      "version": 1,
      "status": "active"
    }
  },
  {
    "id": "Q00480",
    "content": "你愿意为了自己认定的正义，公然违反法律吗？",
    "type": "YN",
    "category": "must",
    "difficulty": "hard",
    "tags": [
      "rule_orientation",
      "pragmatism"
    ],
    "weights": [
      {
        "dimension": "rule_orientation",
        "yes": -5,
        "no": 5
      },
      {
        "dimension": "pragmatism",
        "yes": 3,
        "no": -3
      }
    ],
    "metadata": {
      "version": 1,
      "status": "active"
    }
  }
]