[
  {
    "id": "Q00137",
    "content": "你愿意为了安全起见，提前做好详尽的出行计划吗？",
    "type": "YN",
    "category": "safety",
    "difficulty": "easy",
    "tags": [
      "security",
      "freedom"
    ],
    "weights": [
      {
        "dimension": "security",
        "yes": 1,
        "no": -1
      },
      {
        "dimension": "freedom",
        "yes": -1,
        "no": 1
      }
    ],
    "metadata": {
      "version": 1,
      "status": "active"
    }
  },
  {
    "id": "Q00138",
    "content": "你愿意为了减少意外，定期进行繁琐的安全检查吗？",
    "type": "YN",
    "category": "risk",
    "difficulty": "easy",
    "tags": [
      "security",
      "freedom"
    ],
    "weights": [
      {
        "dimension": "security",
        "yes": 1,
        "no": -1
      },
      {
        "dimension": "freedom",
        "yes": -1,
        "no": 1
      }
    ],
    "metadata": {
      "version": 1,
      "status": "active"
    }
  },
  {
    "id": "Q00139",
    "content": "你愿意为了稳妥，选择熟悉的餐馆而不是尝试新开的一家吗？",
    "type": "YN",
    "category": "social",
    "difficulty": "easy",
    "tags": [
      "security",
      "freedom"
    ],
    "weights": [
      {
        "dimension": "security",
        "yes": 1,
        "no": -1
      },
      {
        "dimension": "freedom",
        "yes": -1,
        "no": 1
      }
    ],
    "metadata": {
      "version": 1,
      "status": "active"
    }
  },
  {
    "id": "Q00140",
    "content": "你愿意为了财产安全，花时间设置复杂的密码吗？",
    "type": "YN",
    "category": "risk",
    "difficulty": "easy",
    "tags": [
      "security",
      "privacy"
    ],
    "weights": [
      {
        "dimension": "security",
        "yes": 1,
        "no": -1
      },
      {
        "dimension": "privacy",
        "yes": 1,
        "no": -1
      }
    ],
    "metadata": {
      "version": 1,
      "status": "active"
    }
  }
]