[
  {
    "id": "Q00453",
    "content": "你愿意为了更多的收入，接受更忙碌的生活吗？",
    "type": "YN",
    "category": "must",
    "difficulty": "easy",
    "tags": [
      "wealth",
      "self_protection"
    ],
    "weights": [
      {
        "dimension": "wealth",
        "yes": 3,
        "no": -3
      },
      {
        "dimension": "self_protection",
        "yes": -3,
        "no": 3
      }
    ],
    "metadata": {
      "version": 1,
      "status": "active"
    }
  },
  {
    "id": "Q00454",
    "content": "你愿意为了生活的稳定，拒绝高风险高回报的机会吗？",
    "type": "YN",
    "category": "must",
    "difficulty": "easy",
    "tags": [
      "security",
      "wealth"
    ],
    "weights": [
      {
        "dimension": "security",
        "yes": 3,
        "no": -3
      },
      {
        "dimension": "wealth",
        "yes": -3,
        "no": 3
      }
    ],
    "metadata": {
      "version": 1,
      "status": "active"
    }
  },
  {
    "id": "Q00455",
    "content": "你愿意为了帮助他人，牺牲一些自己的时间吗？",
    "type": "YN",
    "category": "must",
    "difficulty": "easy",
    "tags": [
      "altruism",
      "self_protection"
    ],
    "weights": [
      {
        "dimension": "altruism",
        "yes": 3,
        "no": -3
      },
      {
        "dimension": "self_protection",
        "yes": -3,
        "no": 3
      }
    ],
    "metadata": {
      "version": 1,
      "status": "active"
    }
  },
  {
    "id": "Q00456",
    "content": "你愿意为了公平，坚持按程序办事即使效率会降低吗？",
    "type": "YN",
    "category": "must",
    "difficulty": "medium",
    "tags": [
      "rule_orientation",
      "pragmatism"
    ],
    "weights": [
      {
        "dimension": "rule_orientation",
        "yes": 3,
        "no": -3
      },
      {
        "dimension": "pragmatism",
        "yes": -2,
        "no": 2
      }
    ],
    "metadata": {
      "version": 1,
      "status": "active"
    }
  }
]