[
  {
    "id": "Q00053",
    "content": "你愿意为了帮朋友准备面试，牺牲自己整个周末的时间吗？",
    "type": "YN",
    "category": "social",
    "difficulty": "easy",
    "tags": [
      "altruism",
      "self_protection"
    ],
    "weights": [
      {
        "dimension": "altruism",
        "yes": 2,
        "no": -2
      },
      {
        "dimension": "self_protection",
        "yes": -2,
        "no": 2
      }
    ],
    "metadata": {
      "version": 1,
      "status": "active"
    }
  },
  {
    "id": "Q00054",
    "content": "你愿意为了帮助新同事熟悉业务，经常加班指导他吗？",
    "type": "YN",
    "category": "social",
    "difficulty": "easy",
    "tags": [
      "altruism",
      "self_protection"
    ],
    "weights": [
      {
        "dimension": "altruism",
        "yes": 2,
        "no": -2
      },
      {
        "dimension": "self_protection",
        "yes": -2,
        "no": 2
      }
    ],
    "metadata": {
      "version": 1,
      "status": "active"
    }
  },
  {
    "id": "Q00055",
    "content": "你愿意为了帮社区老人团购生活用品，每周多跑几趟路吗？",
    "type": "YN",
    "category": "social",
    "difficulty": "easy",
    "tags": [
      "altruism",
      "self_protection"
    ],
    "weights": [
      {
        "dimension": "altruism",
        "yes": 2,
        "no": -2
      },
      {
        "dimension": "self_protection",
        "yes": -1,
        "no": 1
      }
    ],
    "metadata": {
      "version": 1,
      "status": "active"
    }
  },
  {
    "id": "Q00056",
    "content": "你愿意为了帮同事解决家庭危机，替他顶几次重要的班吗？",
    "type": "YN",
    "category": "risk",
    "difficulty": "medium",
    "tags": [
      "altruism",
      "self_protection"
    ],
    "weights": [
      {
        "dimension": "altruism",
        "yes": 2,
        "no": -2
      },
      {
        "dimension": "self_protection",
        "yes": -2,
        "no": 2
      }
    ],
    "metadata": {
      "version": 1,
      "status": "active"
    }
  }
]