[
  {
    "id": "Q00161",
    "content": "你愿意为了保住自己的全部隐私，拒绝一份需要监控你一切行为的高薪工作吗？",
    "type": "YN",
    "category": "control",
    "difficulty": "hard",
    "tags": [
      "privacy",
      "wealth"
    ],
    "weights": [
      {
        "dimension": "privacy",
        "yes": 5,
        "no": -5
      },
      {
        "dimension": "wealth",
        "yes": -4,
        "no": 4
      }
    ],
    "metadata": {
      "version": 1,
      "status": "active"
    }
  },
  {
    "id": "Q00162",
    "content": "你愿意为了守护自己的思想自由，拒绝任何形式的记忆共享技术吗？",
    "type": "YN",
    "category": "privacy",
    "difficulty": "hard",
    "tags": [
      "privacy",
      "freedom"
    ],
    "weights": [
      {
        "dimension": "privacy",
        "yes": 5,
        "no": -5
      },
      {
        "dimension": "freedom",
        "yes": 2,
        "no": -2
      }
    ],
    "metadata": {
      "version": 1,
      "status": "active"
    }
  },
  {
    "id": "Q00163",
    "content": "你愿意为了保留个人边界，放弃使用一切会收集你数据的便利服务吗？",
    "type": "YN",
    "category": "privacy",
    "difficulty": "hard",
    "tags": [
      "privacy",
      "pragmatism"
    ],
    "weights": [
      {
        "dimension": "privacy",
        "yes": 5,
        "no": -5
      },
      {
        "dimension": "pragmatism",
        "yes": -3,
        "no": 3
      }
    ],
    "metadata": {
      "version": 1,
      "status": "active"
    }
  },
  {
    "id": "Q00164",
    "content": "你愿意为了保护自己的身体自主权，拒绝接受任何没有明确告知用途的检查吗？",
    "type": "YN",
    "category": "personal_boundary",
    "difficulty": "hard",
    "tags": [
      "privacy",
      "security"
    ],
    "weights": [
      {
        "dimension": "privacy",
        "yes": 5,
        "no": -5
      },
      {
        "dimension": "security",
        "yes": -2,
        "no": 2
      }
    ],
    "metadata": {
      "version": 1,
      "status": "active"
    }
  }
]