[
  {
    "id": "Q00445",
    "content": "你愿意为了完全的自由，拒绝任何形式的强制安排吗？",
    "type": "YN",
    "category": "must",
    "difficulty": "hard",
    "tags": [
      "freedom",
      "security"
    ],
    "weights": [
      {
        "dimension": "freedom",
        "yes": 5,
        "no": -5
      },
      {
        "dimension": "security",
        "yes": -4,
        "no": 4
      }
    ],
    "metadata": {
      "version": 1,
      "status": "active"
    }
  },
  {
    "id": "Q00446",
    "content": "你愿意为了帮助素不相识的人，长期牺牲自己的时间和精力吗？",
    "type": "YN",
    "category": "must",
    "difficulty": "hard",
    "tags": [
      "altruism",
      "self_protection"
    ],
    "weights": [
      {
        "dimension": "altruism",
        "yes": 5,
        "no": -5
      },
      {
        "dimension": "self_protection",
        "yes": -4,
        "no": 4
      }
    ],
    "metadata": {
      "version": 1,
      "status": "active"
    }
  },
  {
    "id": "Q00447",
    "content": "你愿意为了绝对的安全，放弃一切冒险的可能吗？",
    "type": "YN",
    "category": "must",
    "difficulty": "hard",
    "tags": [
      "security",
      "wealth"
    ],
    "weights": [
      {
        "dimension": "security",
        "yes": 5,
        "no": -5
      },
      {
        "dimension": "wealth",
        "yes": -4,
        "no": 4
      }
    ],
    "metadata": {
      "version": 1,
      "status": "active"
    }
  },
  {
    "id": "Q00448",
    "content": "你愿意为了财富自由，牺牲自己所有的休闲时间吗？",
    "type": "YN",
    "category": "must",
    "difficulty": "hard",
    "tags": [
      "wealth",
      "freedom"
    ],
    "weights": [
      {
        "dimension": "wealth",
        "yes": 5,
        "no": -5
      },
      {
        "dimension": "freedom",
        "yes": -4,
        "no": 4
      }
    ],
    "metadata": {
      "version": 1,
      "status": "active"
    }
  }
]