[
  {
    "id": "Q00277",
    "content": "你愿意为了拯救众多人的生命，违反法律采取行动吗？",
    "type": "YN",
    "category": "morality",
    "difficulty": "hard",
    "tags": [
      "rule_orientation",
      "altruism"
    ],
    "weights": [
      {
        "dimension": "rule_orientation",
        "yes": -5,
        "no": 5
      },
      {
        "dimension": "altruism",
        "yes": 4,
        "no": -4
      }
    ],
    "metadata": {
      "version": 1,
      "status": "active"
    }
  },
  {
    "id": "Q00278",
    "content": "你愿意为了获得巨额财富，参与完全违法的行为吗？",
    "type": "YN",
    "category": "morality",
    "difficulty": "hard",
    "tags": [
      "rule_orientation",
      "wealth"
    ],
    "weights": [
      {
        "dimension": "rule_orientation",
        "yes": -5,
        "no": 5
      },
      {
        "dimension": "wealth",
        "yes": 5,
        "no": -5
      }
    ],
    "metadata": {
      "version": 1,
      "status": "active"
    }
  },
  {
    "id": "Q00279",
    "content": "你愿意为了推翻不公的制度，不惜采取激烈的手段吗？",
    "type": "YN",
    "category": "control",
    "difficulty": "hard",
    "tags": [
      "rule_orientation",
      "collectivism"
    ],
    "weights": [
      {
        "dimension": "rule_orientation",
        "yes": -5,
        "no": 5
      },
      {
        "dimension": "collectivism",
        "yes": 3,
        "no": -3
      }
    ],
    "metadata": {
      "version": 1,
      "status": "active"
    }
  },
  {
    "id": "Q00280",
    "content": "你愿意为了自己认定的正义，彻底无视现有的法律规则吗？",
    "type": "YN",
    "category": "morality",
    "difficulty": "hard",
    "tags": [
      "rule_orientation",
      "pragmatism"
    ],
    "weights": [
      {
        "dimension": "rule_orientation",
        "yes": -5,
        "no": 5
      },
      {
        "dimension": "pragmatism",
        "yes": 3,
        "no": -3
      }
    ],
    "metadata": {
      "version": 1,
      "status": "active"
    }
  }
]