[
  {
    "id": "Q00113",
    "content": "你愿意为了换取丰厚的退休保障，接受政府对你生活的长期统一规划吗？",
    "type": "YN",
    "category": "control",
    "difficulty": "hard",
    "tags": [
      "freedom",
      "security"
    ],
    "weights": [
      {
        "dimension": "freedom",
        "yes": -4,
        "no": 4
      },
      {
        "dimension": "security",
        "yes": 4,
        "no": -4
      }
    ],
    "metadata": {
      "version": 1,
      "status": "active"
    }
  },
  {
    "id": "Q00114",
    "content": "你愿意为了家庭的稳定，放弃自己追求梦想的职业自由吗？",
    "type": "YN",
    "category": "future",
    "difficulty": "hard",
    "tags": [
      "freedom",
      "collectivism"
    ],
    "weights": [
      {
        "dimension": "freedom",
        "yes": -4,
        "no": 4
      },
      {
        "dimension": "collectivism",
        "yes": 3,
        "no": -3
      }
    ],
    "metadata": {
      "version": 1,
      "status": "active"
    }
  },
  {
    "id": "Q00115",
    "content": "你愿意为了获得大额的财富，接受一份终身限制你行动自由的工作吗？",
    "type": "YN",
    "category": "wealth",
    "difficulty": "hard",
    "tags": [
      "freedom",
      "wealth"
    ],
    "weights": [
      {
        "dimension": "freedom",
        "yes": -4,
        "no": 4
      },
      {
        "dimension": "wealth",
        "yes": 4,
        "no": -4
      }
    ],
    "metadata": {
      "version": 1,
      "status": "active"
    }
  },
  {
    "id": "Q00116",
    "content": "你愿意为了获得绝对的安全保障，同意让权威机构安排你的一切生活吗？",
    "type": "YN",
    "category": "control",
    "difficulty": "hard",
    "tags": [
      "freedom",
      "security"
    ],
    "weights": [
      {
        "dimension": "freedom",
        "yes": -4,
        "no": 4
      },
      {
        "dimension": "security",
        "yes": 4,
        "no": -4
      }
    ],
    "metadata": {
      "version": 1,
      "status": "active"
    }
  }
]